{"checks":[{"bound":{"scaleExponent":0,"value":0},"budgetClass":"hard_ceiling","checkClass":"completeness","comparison":"at_most","metricGeneration":1,"metricId":"harness.attachment_missing.count","observations":[{"attemptId":"1b2c3d4e-5f6a-4b8c-9d0e-1f2a3b4c5d41","scaleExponent":0,"value":0},{"attemptId":"1b2c3d4e-5f6a-4b8c-9d0e-1f2a3b4c5d42","scaleExponent":0,"value":0}],"outcome":"passed","phase":"completeness","policyKey":"attachments_retrievable"},{"bound":{"scaleExponent":0,"value":1},"budgetClass":"contract_constant","checkClass":"completeness","comparison":"at_least","metricGeneration":1,"metricId":"harness.observation.sample_count","observations":[{"attemptId":"1b2c3d4e-5f6a-4b8c-9d0e-1f2a3b4c5d41","scaleExponent":0,"value":108000},{"attemptId":"1b2c3d4e-5f6a-4b8c-9d0e-1f2a3b4c5d42","scaleExponent":0,"value":109000}],"outcome":"passed","phase":"completeness","policyKey":"observations_present"},{"bound":{"scaleExponent":0,"value":0},"budgetClass":"hard_ceiling","checkClass":"correctness","comparison":"at_most","metricGeneration":1,"metricId":"harness.assertion_failure.count","observations":[{"attemptId":"1b2c3d4e-5f6a-4b8c-9d0e-1f2a3b4c5d41","scaleExponent":0,"value":0},{"attemptId":"1b2c3d4e-5f6a-4b8c-9d0e-1f2a3b4c5d42","scaleExponent":0,"value":0}],"outcome":"passed","phase":"hard_ceiling","policyKey":"assertions_held"},{"bound":{"scaleExponent":0,"value":0},"budgetClass":"hard_ceiling","checkClass":"correctness","comparison":"at_most","metricGeneration":1,"metricId":"harness.invariant_violation.count","observations":[{"attemptId":"1b2c3d4e-5f6a-4b8c-9d0e-1f2a3b4c5d41","scaleExponent":0,"value":0},{"attemptId":"1b2c3d4e-5f6a-4b8c-9d0e-1f2a3b4c5d42","scaleExponent":0,"value":0}],"outcome":"passed","phase":"hard_ceiling","policyKey":"invariants_held"},{"bound":{"scaleExponent":0,"value":0},"budgetClass":"hard_ceiling","checkClass":"correctness","comparison":"at_most","metricGeneration":1,"metricId":"harness.workload_failure.count","observations":[{"attemptId":"1b2c3d4e-5f6a-4b8c-9d0e-1f2a3b4c5d41","scaleExponent":0,"value":0},{"attemptId":"1b2c3d4e-5f6a-4b8c-9d0e-1f2a3b4c5d42","scaleExponent":0,"value":0}],"outcome":"passed","phase":"hard_ceiling","policyKey":"workload_completed"}],"claimScope":{"performanceClaim":false,"promotionClaim":false,"relativeComparisonClaim":false,"runnerClaim":false,"trustedProvenanceClaim":false},"evaluationId":"bbbbbbbb-cccc-4ddd-8eee-ffffffffffff","evaluatorGeneration":1,"inputs":{"evaluationPolicy":{"byteLength":1563,"digest":"sha256:2d1e3728c40484736adda9b60324749ac69f644a2f9350de90a5faa1f53be455","mediaType":"application/vnd.rawframe.evidence.evaluation-policy.v1+json"},"evidenceSet":{"byteLength":1345,"digest":"sha256:d0a870797b7dffc3b111d453c6b7b2a4ce46985f24e686e8800ce3fdbc9d751d","mediaType":"application/vnd.rawframe.evidence.evidence-set.v1+json"},"metricRegistry":{"byteLength":4975,"digest":"sha256:439661d7333b1fb1a1ac07cc4eb0ad309985091f7725ac5ea2e773322382d5bd","mediaType":"application/vnd.rawframe.evidence.metric-registry.v1+json"},"receipts":[{"attemptId":"1b2c3d4e-5f6a-4b8c-9d0e-1f2a3b4c5d41","descriptor":{"byteLength":3109,"digest":"sha256:665b0cf40e1b876cb856e6eb17a403f2b7740f59ea981e8651211bf924e6196c","mediaType":"application/vnd.rawframe.evidence.raw-run-receipt.v1+json"}},{"attemptId":"1b2c3d4e-5f6a-4b8c-9d0e-1f2a3b4c5d42","descriptor":{"byteLength":3109,"digest":"sha256:289e0ac83b023b30a26bccc9fa066049d4f5792f4c42ba2373fc9806ab544fd0","mediaType":"application/vnd.rawframe.evidence.raw-run-receipt.v1+json"}}]},"metricRegistryGeneration":1,"policyGeneration":1,"recordKind":"evaluation_receipt","schemaVersion":1,"tier":"tier_0","trust":{"provenance":"diagnostic_untrusted"},"verdict":{"checkCount":5,"failedCheckCount":0,"notRunCheckCount":0,"outcome":"passed"}}